{
  "schema_version": 1,
  "id": "lost_signal",
  "order": 8,
  "title": "把信号送出去",
  "map": "research_base",
  "control_mode": "autonomous",
  "localization_mode": "fused",
  "prerequisites": [
    "cross_slope"
  ],
  "seed": 47,
  "objective": {
    "type": "deliver_via",
    "spawn": "robot_bay",
    "via": "supply_station",
    "via_label": "能源模块",
    "goal": "signal_tower",
    "goal_label": "山谷信号塔",
    "goal_visual": "signal_tower",
    "time_limit_s": 180,
    "max_collisions": 0,
    "arrive_tolerance_m": 0.62,
    "via_radius_m": 1.25,
    "goals": [
      {
        "marker": "supply_station",
        "label": "能源模块",
        "action": "pickup",
        "radius_m": 1.25
      },
      {
        "marker": "traffic_trigger",
        "label": "东区交通恢复",
        "action": "summon",
        "radius_m": 1.25,
        "summon_actor": "forklift_finale"
      },
      {
        "marker": "signal_tower",
        "label": "山谷信号塔",
        "action": "complete",
        "radius_m": 0.62
      }
    ],
    "max_arrival_speed_mps": 0.2
  },
  "loadout_rules": {
    "budget": 8,
    "required_slots": [
      "tires",
      "sensor",
      "computer",
      "motor",
      "imu"
    ]
  },
  "teaching": {
    "concept": "dynamic_obstacle_prediction",
    "prediction_prompt": "叉车接近盲区路口时，什么证据能够判断双方是否会同时进入？",
    "knowledge_card": "当前距离只描述“现在”。安全进入需要把动态目标的位置和速度投影到未来，再检查它与机器人计划路径在时间上是否重叠。"
  },
  "score": {
    "safe_min_clearance_m": 0.6,
    "safe_clearance_scope": "dynamic",
    "fast_time_s": 95,
    "efficient_energy_wh": 30
  },
  "rewards": [
    "story.chapter_02_signal"
  ],
  "chapter": 2,
  "mode": "mainline"
}
