{
  "schema_version": 1,
  "id": "signal_watch",
  "order": 25,
  "title": "信号瞭望",
  "map": "research_base",
  "control_mode": "autonomous",
  "localization_mode": "fused",
  "chapter": 4,
  "mode": "experiment",
  "prerequisites": [
    "signal_hold"
  ],
  "seed": 42,
  "objective": {
    "type": "deliver_via",
    "spawn": "robot_bay",
    "via": "supply_station",
    "via_label": "能源模块",
    "goal": "signal_tower",
    "goal_label": "信号塔",
    "goal_visual": "signal_tower",
    "time_limit_s": 180,
    "max_collisions": 0,
    "arrive_tolerance_m": 0.62,
    "via_radius_m": 1.25,
    "goals": [
      {
        "marker": "supply_station",
        "label": "能源模块",
        "action": "pickup",
        "radius_m": 1.25
      },
      {
        "marker": "signal_tower",
        "label": "信号塔",
        "action": "complete",
        "radius_m": 0.62
      }
    ]
  },
  "loadout_rules": {
    "budget": 8,
    "required_slots": [
      "tires",
      "sensor",
      "computer",
      "motor",
      "imu"
    ]
  },
  "teaching": {
    "concept": "sensing_rate",
    "prediction_prompt": "同一条走廊，同一班叉车：12 米射程 5Hz 和 5 米射程 20Hz，哪个活下来？",
    "knowledge_card": "看得远不等于看得及时：5Hz 下叉车每帧走 0.11 米，确认与外推依赖更旧的位置。比较两套配置的预测不确定性、等待时间和最小净距。"
  },
  "score": {
    "safe_min_clearance_m": 0.3,
    "safe_clearance_scope": "dynamic",
    "fast_time_s": 100.0,
    "efficient_energy_wh": 2.5
  },
  "rewards": [
    "ability.signal_watch"
  ]
}
