{
  "schema_version": 1,
  "id": "motor_trial",
  "order": 11,
  "title": "认识电机",
  "map": "research_base",
  "control_mode": "autonomous",
  "localization_mode": "odometry",
  "chapter": 4,
  "prerequisites": [
    "first_sight"
  ],
  "seed": 50,
  "objective": {
    "type": "reach",
    "spawn": "workshop_exit",
    "goal": "calibration_pad",
    "goal_label": "仓库校准点",
    "goal_visual": "calibration_pad",
    "time_limit_s": 60,
    "max_collisions": 0,
    "arrive_tolerance_m": 0.62
  },
  "loadout_rules": {
    "budget": 4,
    "required_slots": [
      "tires",
      "motor"
    ]
  },
  "teaching": {
    "concept": "motors_and_energy",
    "prediction_prompt": "高速电机一定最快吗？扭矩、极速和能耗如何交换？",
    "knowledge_card": "高速齿比提高轮速却降低轮缘力；低速大扭矩适合起步和坡道，正确选择取决于路线与任务。"
  },
  "score": {
    "safe_min_clearance_m": 0.15,
    "fast_time_s": 4.3,
    "efficient_energy_wh": 0.05
  },
  "rewards": [
    "ability.motors"
  ],
  "mode": "experiment"
}
