{
  "schema_version": 1,
  "id": "town_freight",
  "order": 9,
  "title": "城镇首运",
  "map": "signal_town",
  "control_mode": "autonomous",
  "localization_mode": "fused",
  "chapter": 3,
  "mode": "contract",
  "prerequisites": [
    "lost_signal"
  ],
  "seed": 7,
  "objective": {
    "type": "deliver_via",
    "spawn": "town_gate",
    "via": "energy_hub",
    "via_label": "能源中转",
    "goal": "market_gate",
    "goal_label": "集市门",
    "goal_visual": "calibration_pad",
    "time_limit_s": 180,
    "max_collisions": 0,
    "arrive_tolerance_m": 0.62,
    "via_radius_m": 1.25
  },
  "loadout_rules": {
    "budget": 8,
    "required_slots": [
      "tires",
      "sensor",
      "computer",
      "motor",
      "imu"
    ]
  },
  "teaching": {
    "concept": "town_haul",
    "prediction_prompt": "新镇子第一单：湿滑仓门、砂石主街、沙地货道，两辆巡逻车横竖穿行。走哪条道，什么时候让？",
    "knowledge_card": "城镇跑单是快与稳的交换：莽法时间能耗全赢，但最小间隙只有 0.35 米——巡逻车身半径 0.45 米，蹭的是车身。稳法让出时间，换 0.67 米净空和安全分。"
  },
  "score": {
    "safe_min_clearance_m": 0.5,
    "safe_clearance_scope": "dynamic",
    "fast_time_s": 53.0,
    "efficient_energy_wh": 1.41
  },
  "rewards": [
    "ability.town_freight"
  ]
}
