{
  "schema_version": 1,
  "id": "signal_echo",
  "order": 14,
  "title": "信号回响",
  "map": "research_base",
  "control_mode": "autonomous",
  "localization_mode": "fused",
  "chapter": 4,
  "mode": "experiment",
  "prerequisites": [
    "lost_signal"
  ],
  "seed": 42,
  "objective": {
    "type": "deliver_via",
    "spawn": "robot_bay",
    "via": "supply_station",
    "via_label": "能源模块",
    "goal": "signal_tower",
    "goal_label": "信号塔",
    "goal_visual": "signal_tower",
 "time_limit_s": 180,
    "max_collisions": 0,
    "arrive_tolerance_m": 0.62,
    "via_radius_m": 1.25,
    "goals": [
      {
        "marker": "supply_station",
        "label": "能源模块",
        "action": "pickup",
        "radius_m": 1.25
      },
      {
        "marker": "signal_tower",
        "label": "信号塔",
        "action": "complete",
        "radius_m": 0.62
      }
    ]
  },
  "loadout_rules": {
    "budget": 8,
    "required_slots": [
      "tires",
      "sensor",
      "computer",
      "motor",
      "imu"
    ]
  },
  "teaching": {
    "concept": "dynamic_obstacle_prediction",
    "prediction_prompt": "同一条叉车通道再走一次，哪里最值得省时间？",
    "knowledge_card": "同样的路，换一套动力与感知组合，结果完全不同：先看证据，再谈速度。"
  },
  "score": {
    "safe_min_clearance_m": 0.3,
    "safe_clearance_scope": "dynamic",
    "fast_time_s": 75.0,
    "efficient_energy_wh": 2.0
  },
  "rewards": [
    "ability.combo_mastery"
  ]
}
